{
    "domains": [
        "server-01.example.com"
    ],
    "letsencrypt_email": "admin@example.com",
    "letsencrypt_ca": "https://acme-staging-v02.api.letsencrypt.org/directory",
    "letsencrypt_dns_provider": "digitalocean",
    "logging_preset": "production",
    "nats_config": {
        "server_name": "nats-01",
        "port": 4222,
        "host": "127.0.0.1",
        "cluster": {
            "name": "cluster-01"
        },
        "jetstream": {
            "domain": "cluster-01",
            "max_memory_store": 1073741824,
            "max_file_store": 1073741824
        },
        "websocket": {
            "host": "0.0.0.0",
            "port": 10443
        },
        "mqtt": {
            "host": "0.0.0.0",
            "port": 8883
        },
        "leafnodes": {
            "port": 7222
        },
        "operator": "eyJhbGciOiJlZDI1NTE5LW5rZXkiLCJ0eXAiOiJKV1QifQ.eyJuYW1lIjoidGVzdC1vcGVyYXRvciIsInN1YiI6Ik9ETzNJVkQzWkdEWEFFSERET1RET0tVVk40WkM1UVlFU1RONUkyUEFMVk9JTzNDTURFUVdQQVhTIiwiaXNzIjoiT0RPM0lWRDNaR0RYQUVIRERPVERPS1VWTjRaQzVRWUVTVE41STJQQUxWT0lPM0NNREVRV1BBWFMiLCJqdGkiOiJHWE5NU1RYWVlXWTRaVzZCNFYyTUNaMklFSk9KVUhJRTVVUUdaVTIzSTVCTUtGSUFWUUZBIiwiaWF0IjoxNjkzMjYwNDIyLCJuYXRzIjp7InR5cGUiOiJvcGVyYXRvciIsInZlcnNpb24iOjJ9fQ.aadO53UH-iWOBYlC0FdD-8OuO7fG-srsf5Re-_dwqx9BaM3Ps-Y2st_RzBWnMpXgvq-e4GXzRRx1M23pr9HtCA",
        "system_account": "ADNU2QRXBD4ZKPJBX2W4GPYIZPJNU25IVC67TPARE22755KLN4JSJRQH",
        "resolver": {
            "type": "full",
            "dir": "./nats-01/jwt",
            "allow_delete": true,
            "interval": "2m"
        },
        "resolver_preload": {
            "ADNU2QRXBD4ZKPJBX2W4GPYIZPJNU25IVC67TPARE22755KLN4JSJRQH": "eyJhbGciOiJlZDI1NTE5LW5rZXkiLCJ0eXAiOiJKV1QifQ.eyJuYW1lIjoiU1lTIiwic3ViIjoiQUROVTJRUlhCRDRaS1BKQlgyVzRHUFlJWlBKTlUyNUlWQzY3VFBBUkUyMjc1NUtMTjRKU0pSUUgiLCJpc3MiOiJPRE8zSVZEM1pHRFhBRUhERE9URE9LVVZONFpDNVFZRVNUTjVJMlBBTFZPSU8zQ01ERVFXUEFYUyIsImp0aSI6IkdYTk1TVFc1WU5OUEhSRlRXQkM1RU9SQUNNUklQQlk1R0I0VlNUNVFBVTdETDQyVTJVRlEiLCJpYXQiOjE2OTMyNjA0MjIsIm5hdHMiOnsidHlwZSI6ImFjY291bnQiLCJ2ZXJzaW9uIjoyLCJzaWduaW5nX2tleXMiOlt7ImtleSI6IkFDRk9XVTZXQU1UV0NHNzJXWTVYN0pWRFU3WExKU0cyWENQTUZISFQ2M1BIR1RWRzVKVDI1VlVDIiwicm9sZSI6Im1vbml0b3IiLCJ0ZW1wbGF0ZSI6eyJwdWIiOnsiYWxsb3ciOlsiJFNZUy5SRVEuQUNDT1VOVC4qLioiLCIkU1lTLlJFUS5TRVJWRVIuKi4qIl19LCJzdWIiOnsiYWxsb3ciOlsiJFNZUy5BQ0NPVU5ULiouPiIsIiRTWVMuU0VSVkVSLiouPiJdfSwic3VicyI6MTAwLCJwYXlsb2FkIjoxMDQ4NTc2LCJhbGxvd2VkX2Nvbm5lY3Rpb25fdHlwZXMiOlsiU1RBTkRBUkQiLCJXRUJTT0NLRVQiXX0sImtpbmQiOiJ1c2VyX3Njb3BlIn0seyJrZXkiOiJBQlVIM0gzQ0VTRkFXU1NVNE1PTlhOVllKNVpLQ0ZWWlNYM0RHNFNDUEY3RUhFTVBETVE1TVYyNiIsInJvbGUiOiJpc3N1ZXIiLCJ0ZW1wbGF0ZSI6eyJwdWIiOnsiYWxsb3ciOlsiJFNZUy5SRVEuQ0xBSU1TLiouIiwiJFNZUy5SRVEuQUNDT1VOVC4qLkNMQUlNUy4qIl19LCJzdWJzIjoxMCwicGF5bG9hZCI6MTA0ODU3NiwiYWxsb3dlZF9jb25uZWN0aW9uX3R5cGVzIjpbIlNUQU5EQVJEIiwiV0VCU09DS0VUIl19LCJraW5kIjoidXNlcl9zY29wZSJ9LHsia2V5IjoiQURER0FYSDNFRlpQM1NaSlVQQUJCR0tYT1lBT1NTWEpHNVc0VlNaNUxTUTQ2U0ZNRElDNUJJQzMiLCJyb2xlIjoiYWRtaW5pc3RyYXRvciIsInRlbXBsYXRlIjp7InB1YiI6eyJhbGxvdyI6WyI-Il19LCJzdWIiOnsiYWxsb3ciOlsiPiJdfSwic3VicyI6MTAsInBheWxvYWQiOjEwNDg1NzYsImFsbG93ZWRfY29ubmVjdGlvbl90eXBlcyI6WyJTVEFOREFSRCIsIldFQlNPQ0tFVCJdfSwia2luZCI6InVzZXJfc2NvcGUifSx7ImtleSI6IkFCUUM0QkNCR1lKRVlHVzVETFJGVTNZVVI3WVpDU09YNk9FVkcyNlNBTkZQQVZVWUhBVDRUSEdUIiwicm9sZSI6ImxlYWZub2RlIiwidGVtcGxhdGUiOnsicHViIjp7ImFsbG93IjpbIj4iXX0sInN1YiI6eyJhbGxvdyI6WyI-Il19LCJzdWJzIjotMSwiZGF0YSI6LTEsInBheWxvYWQiOjEwNDg1NzYsImFsbG93ZWRfY29ubmVjdGlvbl90eXBlcyI6WyJMRUFGTk9ERSIsIkxFQUZOT0RFX1dTIl19LCJraW5kIjoidXNlcl9zY29wZSJ9XSwiZXhwb3J0cyI6W3siZGVzY3JpcHRpb24iOiJBY2NvdW50IHNwZWNpZmljIG1vbml0b3Jpbmcgc3RyZWFtIiwiaW5mb191cmwiOiJodHRwczovL2RvY3MubmF0cy5pby9uYXRzLXNlcnZlci9jb25maWd1cmF0aW9uL3N5c19hY2NvdW50cyIsIm5hbWUiOiJhY2NvdW50LW1vbml0b3Jpbmctc3RyZWFtcyIsInN1YmplY3QiOiIkU1lTLkFDQ09VTlQuKi4-IiwidHlwZSI6InN0cmVhbSIsImFjY291bnRfdG9rZW5fcG9zaXRpb24iOjN9LHsiZGVzY3JpcHRpb24iOiJSZXF1ZXN0IGFjY291bnQgc3BlY2lmaWMgbW9uaXRvcmluZyBzZXJ2aWNlcyBmb3I6IFNVQlNaLCBDT05OWiwgTEVBRlosIEpTWiBhbmQgSU5GTyIsImluZm9fdXJsIjoiaHR0cHM6Ly9kb2NzLm5hdHMuaW8vbmF0cy1zZXJ2ZXIvY29uZmlndXJhdGlvbi9zeXNfYWNjb3VudHMiLCJuYW1lIjoiYWNjb3VudC1tb25pdG9yaW5nLXNlcnZpY2VzIiwic3ViamVjdCI6IiRTWVMuUkVRLkFDQ09VTlQuKi4qIiwidHlwZSI6InNlcnZpY2UiLCJyZXNwb25zZV90eXBlIjoiU3RyZWFtIiwiYWNjb3VudF90b2tlbl9wb3NpdGlvbiI6NH0seyJkZXNjcmlwdGlvbiI6IlJlcXVlc3QgYWNjb3VudCBKV1QiLCJpbmZvX3VybCI6Imh0dHBzOi8vZG9jcy5uYXRzLmlvL25hdHMtc2VydmVyL2NvbmZpZ3VyYXRpb24vc3lzX2FjY291bnRzIiwibmFtZSI6ImFjY291bnQtbG9va3VwLXNlcnZpY2UiLCJzdWJqZWN0IjoiJFNZUy5SRVEuQUNDT1VOVC4qLkNMQUlNUy5MT09LVVAiLCJ0eXBlIjoic2VydmljZSIsInJlc3BvbnNlX3R5cGUiOiJTdHJlYW0iLCJhY2NvdW50X3Rva2VuX3Bvc2l0aW9uIjo0fSx7ImRlc2NyaXB0aW9uIjoiUmVxdWVzdCBhbGwgc2VydmVycyBoZWFsdGgiLCJpbmZvX3VybCI6Imh0dHBzOi8vZG9jcy5uYXRzLmlvL25hdHMtc2VydmVyL2NvbmZpZ3VyYXRpb24vc3lzX2FjY291bnRzIiwibmFtZSI6InNlcnZlci1oZWFsdGgtc2VydmljZSIsInN1YmplY3QiOiIkU1lTLlJFUS5TRVJWRVIuKi5IRUFMVEhaIiwidHlwZSI6InNlcnZpY2UiLCJyZXNwb25zZV90eXBlIjoiU3RyZWFtIn1dLCJsaW1pdHMiOnsiaW1wb3J0cyI6MTAsImV4cG9ydHMiOjUsIndpbGRjYXJkcyI6dHJ1ZSwiY29ubiI6MTAsImxlYWYiOjEwLCJzdWJzIjoxMDAwLCJwYXlsb2FkIjoyMDk3MTUyfX19.lKZj99iabc2ae4mDKh-l5B-nNX00Vqv2QjwQbR8epLUAhkeFE07IrbVFXxOlnviN2iul6o2o26nK3nX5ss2DBA"
        }
    }
}